,Job Title Index,Job Title,Link,Job Description,Excel,Python,R,SQL,NoSQL,pyspark,java,Javascript,html,Julia,Swift,Bash,Matlab,GCP,AWS,Azure,Big data,Hadoop,MySQL,PostgreSQL,Oracle,MongoDB,Snowflake,IBM,Redshift,Power BI,Tableau,SAP,Qlik
85,0,Data Analyst,https://ca.indeed.com/rc/clk?jk=6529a66395815c8d&fccid=2068a6ece1dbed15&vjs=3,"Malatest is one of Canada’s largest independently owned and operated social research companies with officelocations in Victoria, Edmonton, Ottawa, and Toronto. Areas of our research focus are diverse; however, somecommon areas include health, education, employment and the labour market, housing, and transportation.We offer opportunities for career advancement as well as both internal and external professional development.At Malatest we believe in investing in our employees, and we demonstrate that through our competitive salaries,comprehensive benefits package, and annual bonuses.If you have a passion for research and working as part of a dynamic team, this position would be of interest toyou. We are looking for candidates who have strong technical skills, an understanding of research methods,experience working with complex data sets, strong writing abilities, and excellent time and project managementskills. This opportunity is ideally suited to someone with a background in research, consulting, or is otherwisefamiliar with project management and data analysis with minimal supervision. Education or experience ineconometrics, labour market research, geographic information systems, resource management, databasedevelopment, or transportation planning would be an asset.Key areas of responsibility include:Supports the research manager by providing timely and necessary information required for projectmanagement and communication with clients;Assists in the development and design of different research methods such as survey data collection, analysis,and integration of data from multiple sources; conducting primary research activities;Contributes to the development and implementation of research and evaluation projects, or components ofcomplex research studies;Undertakes data review, analysis, and reporting on large complex data sets using a range of analytical toolssuch as SPSS, STATA, R, SQL, MS Access, MS Excel, GIS and/or other programs.Undertakes sample planning and sample management, data validation and manipulation, quantitative and/orqualitative analyses and report-writing;Contributes to report writing, development of progress reporting tools, and editing and formatting reports forclients;Participates in the implementation of research projects by supporting project management throughorganizing project activities, guiding work flow, and monitoring project hours and budgets.Qualifications:Minimum of a Bachelors degree in the social sciences (e.g., economics/econometrics, sociology, geography,psychology, education/ related discipline), Master’s degree preferred, or a Bachelor’s degree or higher inengineering or another applied science.At least two years of applied work experience in a client-focused environment with responsibility formanaging time and multiple projects from inception to completion. Experience in large-scale quantitativeresearch projects will be considered an asset.Knowledge in the principles of research, program evaluation, research design and methodology, andqualitative and quantitative analysis.Strong writing skills with the ability to clearly communicate complex concepts, document research methods,and describe research results.• Proficiency with technical applications such as MS Access, MS Excel, SPSS, R, SAS, SQL, ArcGIS, QGIS, NVIVO,and/or CATI/CAWI, including programming of scripts in such applications, as well as proficiency in otherstandard MS Office products such as Word, PowerPoint, and Outlook.An understanding of survey data research, analysis and reporting will be considered an asset.Experience conducting a wide array of primary quantitative research such as research design, data collection(methods and data management experience preferred), analysis and reporting.Familiarity with GIS concepts and software will be considered an asset.Malatest staff must adhere to privacy, security, confidentiality, and quality standards and be legally entitled towork and travel in Canada. Working with Malatest to obtain security clearances with the Industrial SecurityDirectorate Division of Public Works and Government Services Canada; will be required.Why Work for Malatest?Malatest is a dynamic and fast-paced research project work environment. We employ a diverse and dynamic teamof researchers at all stages of development (from emerging researchers to experienced experts) who bring avariety of skill sets and educational backgrounds. In addition to a competitive salary and a bonus program, weoffer a full suite of benefits, including RRSP matching and parental leave top-up.MALATEST VALUESTeam Player Client-Focus Business AcumenContinuous Learning Quality Orientation Dedication to ExcellencePosted: October 27, 2021 Closing Date: November 15, 2021Locations: Victoria, BCHours of Work: Permanent full-time, 40 hours per week; while hours of work for the position may vary—with overtimeas required to meet the requirements and expectations of the position.Rate of Pay: $55,000.00 to $80,000.00 per year (based on qualifications), plus benefits and performance bonus.How to Apply?Submit your resume, cover letter, and application form to Malatest. No calls please.Please quote the competition number RAM-21RA within the subject line and content of your application by e-mail.By Mail:E-mail: (Word or pdf) Fax:858 Pandora Averesumes@malatest.com 1-888-384-2774Victoria BC V8W 1P4Malatest is an equal opportunity employer and will not discriminate against any employee or applicant from employment forwhich the employee or applicant is most qualified. You are welcome to identify within your application if you belong to one ofthe four designated equity groups: women, Aboriginal peoples, persons with disabilities and/or members of visible minorities.",1,0,1,1,0,0,0,0,0,0,0,0,0,0,0,0,0,0,0,0,0,0,0,0,0,0,0,0,0
86,0,Data Analyst,https://ca.indeed.com/rc/clk?jk=c3ee7d377a0397bb&fccid=372890e7eec03dda&vjs=3,"At Saputo, our best comes from our people. We’re a talented and caring team with a longstanding history of excellence. Since our first days delivering cheese on a bicycle, we’ve grown into a leading global dairy processor by staying true to the culture that defines us. Each of our employees is committed to uphold our tradition of care, quality, and passion through food, and together, we foster an environment where we can all make contributions that matter–from our manufacturing plants to our office locations and everywhere in-between.Overview of the RoleAs a member of the Finance & Administration team, the Data Analyst will act as the resource person for the Customer and price maintenance Team based in Montreal. The responsibilities will encompass timely and accurate maintenance of our customer and price data base, while ensuring effective financial processes, practices and controls are in place.How you will make contributions that matter:Ensure that customer and pricing master data is clean, relevant, and complete, according to master data governance policies and rules.Become an expert in the business processes to resolve issues, and drive discipline.Act as the key contact for the national sales team for all matters related to pricing, and customer setup.Oversee the data maintenance mailboxes.Support the national price increase process and ensure required controls are in place.Complete business analyses and other projects as assigned from time to time.Backup the supervisor when required.Will be involved business decisions and execution of organizational initiatives within the finance scope.Must be able to execute and lead ERP initiatives with cross functional departments.You are best suited for the role if you have the following qualifications:Proficient in working with, Identifying and reporting data quality issues in large amount of information.Highly competent with Microsoft Excel, Access, and reporting tools such as MicroStrategy.Understand how data is used within business processes and its impact on the business.Excellent verbal and written communication skills and the ability to interact professionally with a diverse group.Excellent attention to details.Strong organizational and time management skills and ability to prioritize workload.5 years of experience in a similar data analytic position.Bachelor’s degree in Business, Accounting, Engineering, Statistics, Mathematics, or related fields.Strong team orientation and a proven ability to work well with others.We support and care for our employees and their families by providing:Competitive salariesAdvantageous corporate agreementsFull range of group insurance benefitsGroup retirement pension plan with employer contributionPurchase option of company stocksGroup RRSPHealth and wellness program in the workplaceAssistance program for employees and their familiesSaputo products at a discounted priceWe support employment equity. Saputo strives to embed diversity and inclusion in its operations and invites candidates from all horizons to join its family.Our story began in Canada in 1954, when the Saputo family's hard work and dedication created a thriving dairy business. More than 65 years later, our roots in this country remain strong with our Corporate Headquarters in Montréal. Today, we are a leading cheese manufacturer and fluid milk and cream processor in Canada with well-loved brands, such as Saputo, Alexis de Portneuf, Armstrong, Baxter, Dairyland, Joyya, Milk2Go, Milk2Go Sport, Neilson, Nutrilait, Scotsburn* and Woolwich Goat Dairy. Thanks to our national footprint, we're proud to bring our best to our customers and consumers, and have plenty of opportunities for our employees to grow in their own way. And we do it while also striving to build a healthier future for our people and the communities where we operate, guided by our values and the Saputo Promise. To learn more about Saputo in Canada, please click here. ( http://saputo.com/en/our-products/canada-sector )Join the Saputo Dairy Products Canada team to make your contributions matter every day!SCOTSBURN is a registered trademark and is used under license by Saputo Dairy Products Canada G.P.The material contained herein is provided for informational purposes only. All open jobs offered by Saputo Inc. and all companies, corporations, partnerships, limited partnerships and other entities controlled by Saputo Inc. (collectively, “Saputo”) on Saputo's web site are subject to specific job skill requirements. The job skill requirements, qualifications, and preferred experience are determined by a Saputo subsidiary, office or department, and all positions are subject to local prevailing employment laws and restrictions. This would include immigration laws pertaining to work authorization requirements and any other applicable government permissions or compliance. The materials on this site are provided without warranties of any kind, either expressed or implied, including but not limited to warranties regarding the accuracy or completeness of the information contained on this site or in any referenced links. While Saputo attempts to update this site on a timely basis, the information is effective only as of the time and date of posting. Strict confidentiality will be observed at all times. Saputo is an equal opportunity employer. The information on this site is for information purposes only and is not intended to be relied upon with legal consequence.Saputo welcomes and encourages applications from people with disabilities. Accommodations may be available upon request for candidates taking part in all aspects of the selection process.",1,0,1,0,0,0,0,0,0,0,0,0,0,0,1,0,0,0,0,0,0,0,0,0,0,0,0,1,0
87,0,computer systems analyst,https://ca.indeed.com/rc/clk?jk=d75408b055b45814&fccid=4b5335c58831cb05&vjs=3,"or equivalent experienceWork SettingComputer hardware or software retailer/wholesalerSpecific SkillsConfer with clients to identify and document requirementsConduct business and technical studiesDesign, develop and implement information systems business solutionsProvide advice on information systems strategy, policy, management and service deliveryAssess physical and technical security risks to data, software and hardwareDevelop and implement policies and procedures throughout the software development life cycleDevelop policies, procedures and contingency plans to minimize the effects of security breachesConduct reviews to assess quality assurance practices, software products and information systemsComputer and Technology KnowledgeDatabase softwareNetworking softwareNetworking hardwareNetworking securitySecurity softwareData analysis softwareCloud",0,0,1,0,0,0,0,0,0,0,0,0,0,0,0,0,0,0,0,0,0,0,0,0,0,0,0,0,0
88,0,Data & BI Analyst,https://ca.indeed.com/rc/clk?jk=8522741120335cc1&fccid=9b916fc9230716d1&vjs=3,"At Neo, we empower people to get the most out of their money and time. We're a tech company reimagining everyday banking from the ground up to create rewarding experiences and build community for all Canadians. We're looking for passionate go-getters who want to move fast and create a lasting impact.We are looking for an enthusiastic Data & BI Analyst who wants to jump on board to help build a leading-edge tech company in Calgary, AB. You will experience the ins and outs of a fast-growing startup with the opportunity to make a real difference. You will get to learn and work alongside high-performing entrepreneurs in a fast-paced, innovative, and rewarding environment.What you'll be doing:Reviewing and analyzing data from multiple sourcesCreating, maintaining, and updating company dashboardsSupporting the marketing, rewards, customer growth, and engagement teams with their data needs and requirementsExtracting and communicating insights from dataHandling day-to-day data requestsEngaging with the data engineering team to ensure data quality and integrityReviewing data reportsWho we're looking for:2+ years of experience creating and maintaining dashboardsProven track record of being able to convert data into meaningful insightsStrong understanding of SQL. Experience using tools such as Looker, PowerBI, or TableauFamiliarity with Python, or PySpark is a big plusWhat will help you succeed:You have great attention to detail and a high standard of outputYou challenge the status quo and look for ways to continuously improveYou're an effective communicator with strong organizational skillsYou are incredibly driven and hungry to learnYou are a strong team player who can excel in a fast-paced environmentWhat it’s like to work with us:At Neo, you’ll be working with industry-leading technology that changes the way we live and realize a better financial future. It’s a serious deal, but that doesn’t mean we don’t know a thing or two about having fun. Our entrepreneurial environment gets our adrenaline pumping and beats the regular 9-5 job. We’re in it together, always. Gain hands-on experience and be part of the future.About applying with Neo:Please apply using Chrome, as applications are only supported using Chrome on desktop.Neo Financial is an equal opportunity employer. We are excited to meet with and hire the top talent out there. We appreciate your interest in working with us; however, only those applicants selected for interviews will be contacted. Successful candidates for this position will be required to undergo a security screening, including a criminal records check and may require a credit check.",1,1,1,1,0,1,0,0,0,0,0,0,0,0,0,0,0,0,0,0,0,0,0,0,0,0,1,0,0
89,0,Engineering Data Analyst,https://ca.indeed.com/rc/clk?jk=a4ea2e998585f1a2&fccid=b91922739a3e270a&vjs=3,"We are looking for candidates who have the skill, energy, attitude and curiosity to ensure efficient and cost-effective operations at all times through careful planning and management of available resources.This position offers an exciting opportunity to be part of a highly successful and leading container terminal in the East Coast of Canada. The position offers a competitive salary with annual performance-based incentives, medical benefits for individual and family, contributive pension benefits and opportunities for training and development.PRIMARY FUNCTION:The primary function of the Engineering Data Analyst ensures that all data is accurately captured and recorded to plan preventative maintenance, the same data will be used for KPI's. The position will ensure that all costs including parts and labor related to preventative maintenance are entered correctly into the maintenance software program by the department Supervisors daily. The position also will be assisting in the management information system comprising of KPI/KPOs and in achieving the goals and objectives as laid out in the functional plan of the Engineering Department.DATA ANALYST DELIVERABLES:Be a leader in terms of driving safety through the engineering organization.Centralize all data entry related activities including, but not limited to, labour work hours, breakdown records, equipment fuelling, preventative maintenance observations and customer fuel trackingAssist the Engineering Planning Superintendent in developing a highly efficient Preventive Maintenance Program.Data analysis on engineering costs and other organizational metrics to improve both cost and productivity in the organization.Support management with relevant and timely data regarding the efficiency and effectiveness of various processes in the organization.Assist Engineering Planning Superintendent in procurement process and keep records up to date.Assist the Engineering Planning Superintendent in planning preventative maintenance on existing and new equipment of the terminal, implementing a proper planning team for the maintenance of the various categories of equipment, especially STSs and RTGs and yard equipment.Drive the organization in terms of Total Productive Maintenance System implementation and live the value of ""GO and SEE"" (Genchi Genbutsu).Drive 5 S program in the workplace of the organization.QUALIFICATIONS: The candidate should have at least 2-5 years of experience in data analytics and planning activities. Should have experience in a large organization in the middle management role and high visibility projects. Should have knowledge of local and oversee parts suppliers on Container handling equipment. Excellent office computer skills; familiarity with Megamation software is an advantage.WORK ENVIRONMENT: The work environment characteristics described here are representative of those an employee encounters while performing the essential functions of this job.Basic industrial office working environment.Workshop working conditions and on site during all weather conditions.Ability to work from heights, top of cranes, ladders, scaffolds and lifts.Ability to work independently and with minimal supervision.Being on call 24/7 in the event of emergencies.There will be requirements to work weekends, holidays and nights, as per Terminal operational requirements.May have to work in areas where noise is moderate.PPE safety vest, safety glasses, hearing protection and CSA approved work boots while on terminal area requirements at all times.HOURS OF WORK: This position works regularly 7:30 a.m. to 4:30 p.m.; however, the incumbent will need to be available when needed. The position may include work during weekends and in overtime period as per the demands of the equipment maintenance.Working in overtime will be required from time to time without notice.COMPENSATION: Permanent, full time salaried position with an attractive benefits package.TO APPLY: Submit a cover letter and resume to:careers@psahalifax.comPSA Halifax is an equal opportunity employerDate PostedNov 4, 2021TypeFull-time - PermanentCareer LevelExperiencedCategoryEngineeringCompetition NumberEDA1103-CB",1,0,1,0,0,0,0,0,0,0,0,0,0,0,0,0,0,0,0,0,0,0,0,0,0,0,0,0,0
