,Job Title Index,Job Title,Link,Job Description,Excel,Python,R,SQL,NoSQL,pyspark,java,Javascript,html,Julia,Swift,Bash,Matlab,GCP,AWS,Azure,Big data,Hadoop,MySQL,PostgreSQL,Oracle,MongoDB,Snowflake,IBM,Redshift,Power BI,Tableau,SAP,Qlik
0,0,Junior Data Analyst,https://ca.indeed.com/rc/clk?jk=1fd5cc124fd8fcaf&fccid=47b2425a6076f68f&vjs=3,"The Opportunity:O2E Brands is looking for a Junior Data Analyst to join our growing team! As part of the Business Intelligence department, you will play a pivotal role in maturing our use of data across the organization. Working closely with our data engineers, you will help build and maintain the decision support tools for our business units to enable data driven decision making!A Day in the Life:Design, develop, maintain and optimize reports and dashboardsEnsure consistent application of data governance initiativesContribute to and keep up to date both the data catalog and report inventoryBuild data collection and decision support toolsActively participate and contribute to the Tableau Analyst GroupWhat You Bring to the Table:A university degree or diploma in Computing Science, Statistics, Mathematics, Business or similar disciplines1+ years of work experience in Business Intelligence and AnalyticsProficiency in writing SQL queries across multiple tablesPassion for data visualization with TableauExperience blending data from disparate sourcesDemonstrated ability commit to deliverables and manage priorities effectivelyExcellent verbal and written communicationsKnowledge of Python and Agile Scrum would be considered an assetAbout Us:Did you know O2E Brands has been voted one of the Best Workplaces in Canada 12 times!?Take a sneak peek into why that is, here: (https://youtu.be/DJA02gMNU-0)Check us out on social!At O2E Brands we know that great talent comes in many forms and we want to meet you at your best. We will provide reasonable accommodations to applicants with disabilities at any time throughout the recruitment and selection process. Please reach out to our Talent Acquisition Team at talentacquisition@o2ebrands.com or notify the Talent Acquisition team member you are working with if unique arrangements will enable your equal participation.",1,1,1,1,0,0,0,0,0,0,0,0,0,0,0,0,0,0,0,0,0,0,0,0,0,0,1,0,0
1,0,Procurement Data Analyst,https://ca.indeed.com/rc/clk?jk=e6af5c963de116ef&fccid=bc3edde79fc08191&vjs=3,"About the City of HamiltonContribute to the City of Hamilton, one of Canada’s largest cities - home to a diverse and strong economy, an active and inclusive community, a robust cultural and dining scene, hundreds of kilometres of hiking trails and natural beauty just minutes from the downtown core, and so much more. Join our diverse team of talented and ambitious staff who embody our values of sensational service, courageous change, steadfast integrity, collective ownership and being engaged empowered employees. Help us achieve our vision of being the best place to raise a child and age successfully. #BeTheReasonJOB POSTINGJOB ID #: 17624Procurement Data AnalystCorporate ServicesFinancial Services, Taxation & Corporate ControllerLister Block, 28 James St. NNUMBER OF VACANCIES: 1 Full-Time RegularUNION/NON-UNION: CUPE Local 5167 InsideHOURS Of WORK: 35 per weekGRADE: ISALARY/HOUR: $32.551 - $36.990 per hourNote: See appropriate Collective Agreement or the Non Union Salary Range for details.STATUS/LENGTH: Full-Time RegularJob Description ID #: 7208SUMMARY OF DUTIESReporting to the Procurement Manager, responsible for analyzing and monitoring data for reporting purposes on the adherence to the City’s Procurement Policy and Procedures and contractual agreements with vendors. Monitors City expenditures to ensure compliancy, investigates any discrepancies and reports findings. Enters and analyses data in applicable software programs and assists with the preparation of procurement activity reports and presentation material submitted to Council. Assists in developing, implementing and maintaining policies and procedures related to Procurement as well as procurement related training programs.GENERAL DUTIESPerforms analysis on various Procurement related data including but not limited to City expenditures, bid submissions, contract compliance and procurement compliance.Compiles data from various sources, procurement programs and databases including PeopleSoft, bids&tendersTM, Biddingo, and Excel to produce comprehensive reports.Produces spreadsheets for reporting and assists with the preparation of procurement activity reports and presentation material submitted to Council.Examines, analyzes, reconciles and reports on vendor invoices, matches to delivered services and products and confirms compliance with purchase agreements and service level agreements.Perform analysis on vendor invoices and reports on discrepancies and violations of contract documents and/or procurement policies.Develops and maintains a system to monitor City wide expenditures. Produces analysis to support expenditures are in accordance with contractual agreements and Procurement Policies. Reports findings to Procurement Manager and/or Procurement Analyst.Consults and liaises with the City staff to gain an understanding of the goods and services procured and to attain necessary documentation required to complete any spend analysis.Assists in developing, implementing and maintaining policies and procedures related to Procurement.Assists in the development and maintenance of training programs in order to effectively transfer knowledge of Procurement policies and procedures to all levels of users.Participates in special projects. May be assigned to an initiative or project requiring the individual to take direction from Procurement Manager and/or Procurement Analyst.Attends project team meetings as required.Performs other duties as assigned related to the responsibilities of the job.Works in accordance with the provisions of applicable Health and Safety legislation and all City of Hamilton corporate and departmental policies and procedures related to Occupational Health and Safety.QUALIFICATIONSPrevious experience related to duties listed above normally acquired through the completion of a Community College diploma in Business, Accounting or other appropriate field and/or a combination of education and relevant work experience.Strong analytical skills. Demonstrated ability to research, produce information and create clear/concise written documentation.Demonstrated strong administrative skills with excellent attention to detail involving coordinating, reporting and tracking procurement related documents. gained through practical experience.Experience in a computerized environment. Proficiency utilizing Microsoft Office Suite (Word, Excel, PowerPoint) and other software programs as required. Demonstrated experience with PeopleSoft an asset.Must have detailed and advanced working knowledge and experience with Excel. Demonstrated ability to develop and analyze complex reports using Excel functionality such as formulas and linking.Strong interpersonal and customer service skills.Demonstrated problem-solving skills and the ability to multitask and prioritize in a busy environment, while maintaining accuracy within tight deadlines.Excellent verbal and written communication skills as demonstrated through the production of reports for publication, presentation and service development.Ability to present data to meet the needs of various users.Strong interpersonal skills with a demonstrated ability to work effectively with others. Ability to display and foster teamwork within the work unit, relate to City staff and the public in a tactful and courteous manner.Disclaimer:Be advised that Human Resources frequently audits resumes of internal/external applicants to ensure/validate information provided is consistent and trustworthy. Falsification of information provided at any time throughout the recruitment process may be grounds for disqualification, and for internal applicants, subject to discipline up to and including termination.Terms:The City is an equal opportunity employer that is committed to inclusive, barrier-free recruitment and selection processes. Consistent with our Values and Corporate Culture Pillars, the City of Hamilton is committed to providing equitable treatment to all with respect to barrier-free employment and accommodation without discrimination. The City will provide accommodation for applicants in all aspects of the hiring process, up to the point of undue hardship. If you have an accommodation need, please contact Human Resources as soon as possible to make appropriate arrangements.We invite you to visit the departmental webpage to obtain further information on the culture and business of this department.The incumbent shall comply with all Health and Safety Policies and Practices for this position and the workplace.It is the responsibility of the applicants to ensure that their application reaches Human Resources by the closing date or they may not be considered. It is also the responsibility of applicants to supply qualifications, licences and related experience relevant to the qualifications outlined above for this competition as directed. On the basis of the criteria set out above, this posting is open to all applicantsThe statements made by me are true, complete and correct to the best of my knowledge. I understand that any falsification of statements, misrepresentations, deliberate omission or concealment of information may be considered just cause for discipline, up to and including termination for internal applicants and disqualification for external applicants.",1,0,1,0,0,0,0,0,0,0,0,0,0,0,0,0,0,0,0,0,0,0,0,0,0,0,0,0,0
2,0,Data Analyst & Content Creator,https://ca.indeed.com/rc/clk?jk=d2c335727b9042fd&fccid=931422b89ad640a6&vjs=3,"Foundation is a digital content marketing agency that focuses on planning, creating, and distributing content for B2B brands. We work with software companies that are redefining business in their industry along with ambitious B2B brands growing faster than ever. Our team operates 100% remotely and we're obsessed with growth.We run a lean B2B content-driven machine. We own and manage multiple brands. We develop content -seen by millions. We collaborate with some of the brightest in the industry. We have clients from around the world. And we're just getting started.Date PostedOct 28, 2021TypeFull-time - PermanentCareer LevelExperiencedCompensation$50,000 - $70,000 / yearCategoryMarketing and AdvertisingWebsitehttp://foundationinc.coRemoteCan Work Remotely",0,0,1,0,0,0,0,0,0,0,0,0,0,0,0,0,0,0,0,0,0,0,0,0,0,0,0,0,0
3,0,Data Analyst,https://ca.indeed.com/company/Affinity.co/jobs/Data-Analyst-017314c12c1eec72?fccid=1b32be4e9bf5cb2a&vjs=3,"Remote ( Canada )The RoleData is at the heart and core of Affinity’s business and our lean, mean, data team needs a passionate Product Data Analyst who will influence leaders across the business to make more data-informed decisions. You will be pivotal in finding insights and opportunities from our various compelling data sources that will help us continue growing. What’s more, you won’t only show up to excel at what you do, but also to be key in influencing a world where anyone can cultivate and fully harness their network to succeed.What you will be doing?: Collaborate cross-functionally with go-to-market, engineering, and product teamsIdentify and analyze varied types of data to discover trends and patternsAutomate and manage complex ETL/ELT jobs to a data warehouseEffectively visualize data in a meaningful and informative wayPropose recommendations and findings based on your analyses to business leaders, executives, and key stakeholdersEstablish KPIs that help track the health of our businessInfluence and empower your fellow coworkers to make more data-driven decisionsWhere beneficial to the business, build predictive models and machine-learning algorithmsUphold high standards of data ethics and the responsible use of dataWork with our stack:Data Warehouse: Amazon RedshiftETL/ELT: dbt, StitchBI: Looker, AmplitudeQualificationsRequired: 3+ years of proven experience as a Data Analyst or Data ScientistExceptional SQL skillsExperience creating complex transform jobs to cleanup and aggregate dataAnalytical mindset and business acumenProblem-solving aptitudeExcellent communication and presentation skillsExperience with:Business intelligence tools (e.g. Tableau, Looker, Amplitude)Data warehouses (e.g. Redshift, PostgreSQL)Bonus points if: Experience with:ETL/ELT orchestration tools (dbt, Stitch, Fivetran, Airflow)GithubKnowledge of R, PythonExperience writing and instrumenting ETL or ELT jobs in PythonWhat you’ll enjoy at AffinityWe live our values as playmakers who are obsessed with learning, care personally about our colleagues and clients, are radically open-minded, and take pride in everything we do.Health Care coverage and flexible personal & sick days. We want our team to be happy and healthy : )We provide an annual budget for you to spend on education and offer a comprehensive L&D program – after all, one of our core values is that we’re #obsessedwithlearning!We support our employee’s overall health and well-being and reimburse monthly for things such as; Transportation, Home Internet, Meals, and Wellness memberships/equipment.Virtual team building and socials. Keeping people connected is essential.About UsAt Affinity, we are passionate about helping dealmakers in the world’s biggest relationship-driven industries to find, manage, and close the most important deals. Our Relationship Intelligence platform uses the data exhaust of trillions of interactions between Investment Bankers, Venture Capitalists, Consultants, and other strategic dealmakers with their networks to deliver automated relationship insights that drive over 450,000 deals every month. We have raised over $120M and are backed by some of Silicon Valley’s best firms. With over 1700 customers in 70 countries on our platform, a Glassdoor rating of 4.9, and being ranked in the Inc. 5000 fastest growing companies, we need more great people to help us scale even more.The more diverse our team is, the more we’ll be able to learn from each other, and the better our company and our product will be. Whatever your gender, race, sexual orientation, religion, age, veteran status, favorite Spotify playlist, or social, cultural, and economic background, we can’t wait to welcome you to Affinity!Job Type: Full-time",1,1,1,1,0,0,0,0,0,0,0,0,0,0,0,0,0,0,0,1,0,0,0,0,1,0,1,0,0
4,0,data analyst - informatics and systems,https://ca.indeed.com/rc/clk?jk=ab2f226d320093ce&fccid=18b8a5794f3457fb&vjs=3,Management Systems (erp or db)OracleMySQLMS AccessMS SQL ServerBusiness Equipment and Computer ApplicationsMS ExcelProgramming LanguagesMySQLPythonWork Conditions and Physical CapabilitiesFast-paced environmentWork under pressureAttention to detailComputer and Technology KnowledgeDatabase softwareProgramming languagesData analysis softwarePersonal SuitabilityAccurateTeam playerJudgementOrganizedBenefitsOther Benefits,1,1,1,1,0,0,0,0,0,0,0,0,0,0,0,0,0,0,1,0,1,0,0,0,0,0,0,0,0
5,0,Data Analyst,https://ca.indeed.com/rc/clk?jk=917d490cacf2445c&fccid=b9aac0b77fa7d6b1&vjs=3,"We are looking for a motivated team player to be a part of our data analysis team to further enhance our industry leading IoT leak monitoring and condition assessment products. Our IoT products are deployed in large numbers throughout municipalities to assist our customers in managing their water infrastructure. The successful candidate will have the opportunity to engage with large volumes of data while analyzing acoustic data files collected be our deployed sensors.Key ResponsibilitiesAnalyze acoustic data files collected identifying variances from the set baselinePerform exploratory data analyses to investigate data sets, capture key data findings, and propose solutions to stakeholdersEngaging with large volumes of data, using data modeling/manipulation techniques within a Microsoft SQL Server Data Warehouse environment to develop reporting capabilities and valuable business insightsTranslating reporting requirements into production reports and dashboardsCreate and track relevant key risk metrics across platforms to support the delivering of insights to key stakeholdersAnalyze data and work with Senior Data Analysts and Product Engineers to adjust analysis software for best outcomes including defining acceptance criteriaMonitor process performance through KPIs and strive for continuous improvement and further developmentPrepare and update Standard Operating Procedure documents as requiredBuild and maintain relationships with external leak detection customersPrepare and distribute reports to external customers regarding their leak assessment resultsWork in compliance with the MWP Code of conduct and all Environmental, Health and Safety policies, procedures and regulationsOther duties as assignedPosition RequirementsBachelor’s Degree in Engineering or a quantitative field (Physics, Mathematics or Computer Science)1+ years’ experience with various file formats and data conversionStrong analytical skills, including data mining and statistical analysis.Experience with data extraction, manipulation and visualization using Python.Strong SQL experience with a focus on reproducibility and readability.Strong business acumen and ability to translate business needs into data requirements.Ability to understand advanced concepts in physics and acoustics.Highly analytical, creative, and innovative approach to solving difficult problems.Personal skills: good communicator, perseverant, detail-oriented, self-starter.Echologics is located in the Junction Triangle neighborhood of Toronto. Our office is transit accessible via GO Transit/ UP Express (Bloor GO Station) as well as TTC Dundas West station.Echologics is committed to providing accommodation for people with disabilities. Accommodation is available, upon request, for candidates participating in the recruitment process.We are an equal opportunity employer. All qualified applicants will receive consideration for employment without regard to race, color, religion, sex, sexual orientation, gender identity, national origin, disability, status as a protected veteran, or any other category protected by law.",0,1,1,1,0,0,0,0,0,0,0,0,0,0,0,0,0,0,0,0,0,0,0,0,0,0,0,0,0
