,Job Title Index,Job Title,Link,Job Description,Excel,Python,R,SQL,NoSQL,pyspark,java,Javascript,html,Julia,Swift,Bash,Matlab,GCP,AWS,Azure,Big data,Hadoop,MySQL,PostgreSQL,Oracle,MongoDB,Snowflake,IBM,Redshift,Power BI,Tableau,SAP,Qlik
57,0,"Data Analyst, Competitive Intelligence",https://ca.indeed.com/rc/clk?jk=4ed398705822e85f&fccid=97d82e5ee0248fef&vjs=3,"You found us. Awesome. Something led you here, maybe a glimpse of potential and something amazing? Well that’s how we feel about Klue.Everyone has competitors, yet few know them well. Cue Klue. We are a team relentlessly focused on creating industry leading software to enable every department of every business to leverage the best of the web’s knowledge and the collective insights of their own people.We are a high-growth company with:An experienced leadership team at the helmRisk-takers and builders who own it and get IT doneCombined group, who love the fact that not everything is defined, so we can innovate, create, igniteJoining Klue, you’ll have the opportunity to own your zone, experiment and find what works. Then execute with the support of a team propelling you forward. We’re all creating this industry leading product. It's an experience that will no doubt change your career forever.The Insights' team scope covers data validation for existing sources, outsourced content, and new potential data sources. This role is focused on quality checks at scale and you will be key in ensuring that our data providers and outsourced content creators are delivering high-quality content that is linked back to source data. As the data marketplace is always evolving, you will also be involved in POC's of new data sources that can support manual curation initiatives.This is You:Highly analytical and critical thinkerAbility to digest and communicate complex dataYou like ambiguity and thrive in fast-paced environmentsYou are an Excel and/or Python masterStrong communicator and natural networkerYou like to learn new things and are keen to become an expertIf you’re hooked and feeling more curious about us, or the role - reach out. Let’s see if there is a fit, now or in the future. We’re an award winning company that’s got something pretty special going on here. Don’t miss your chance to have a seat on the rocketship before it takes off.As #kluecrew grows, we’ve made a commitment to support and contribute to a diverse environment; on our teams and in our community. While we’ll admit we haven’t figured it all out and realize this is a long journey for us all. We’re proud to be an equal opportunity employer and have dedicated that commitment to our current and future #kluecrew. During the interview process, please let us know if there is anything we need to make more accessible or accommodate to support you to be successful.All interviews will be conducted via video calls. We will continue, while safe to work in a hybrid model of WFH (remote) and in-office. We are excited to work together again in a space, but just as excited to have great people across timezones help us strive for that high quality asynchronous team communication.",1,1,1,0,0,0,0,0,0,0,0,0,0,0,0,0,0,0,0,0,0,0,0,0,0,0,0,0,0
58,0,Data Analyst,https://ca.indeed.com/rc/clk?jk=b5ac72a3b4062f37&fccid=c908408e676247d6&vjs=3,"OPENTEXT - THE INFORMATION COMPANYAs the Information Company, our mission at OpenText is to create software solutions and deliver services that redefine the future of digital. Be part of a winning team that leads the way in Enterprise Information Management.LIFE at OPENTEXT:At OpenText and in IT, we believe in every employee having meaningful, purposeful work. By joining our team, you will join a community of supportive and collaborative peers focused on innovation, teamwork, and driving successful outcomes. You’ll be expected to bring with you an ideation and “Yes, if” mindset. And, as you build your network and demonstrate your professional excellence, you will have the opportunity to forge your own career path and professional growth.The Opportunity:The Data Analyst will focus on business and data analysis in support of the delivering advanced analytics to our OpenText business partners. This individual will be a professional that is self-motivated and driven to accomplish company goals and who is comfortable multitasking in a fast paced, dynamic environment.You Are Great At:Working with business teams in all parts of the business to gather conceptual business needs, and translate them into clear functional business requirements.Conduct deep-dive analysis of business problems across the enterprise using advanced techniques (statistical modeling, experimentation, causal inference) to identify patterns, uncover opportunities and generate actionable insights.Create process models, diagrams, charts, visuals, and PowerPoint presentations.Work with technical teams and/or study relational database tables to create Technical Data Requirements from Business Requirements.Work with application support, product management and engineering teams on quarterly upgrades and feature requests for Magellan product suite.Self-motivated and driven to accomplish company goals and who is comfortable multitasking in a fast paced, matrixed environment.Perform data preparation, linkage, and feature selection.Calculating model accuracy.Provide end user support and training as needed.What You’ll Bring:Bachelor’s degree in Computer Science, Statistics, Engineering, Business or equivalent experience.5 + years proven abilities related to data analysis, reporting, and analytics supporting a risk, finance, marketing, or sales environment.Experience working with large datasets.Experience transforming data.Experience with SQL, Python and R.Familiarity with data exploration and data visualization tools.Excellent listening, interpersonal, written, and oral communication skills.Experience with OpenText Magellan preferred.Experience working in a complex, matrix, fast paced environment.Attention to detail with emphasis on accuracy and quality.Ability to prioritize work to balance multiple projects and deadlines.The ability to work independently, as part of a team, and cross-functionally within the organization.OpenText's efforts to build an inclusive work environment go beyond simply complying with applicable laws. Our Employment Equity and Diversity Policy provides direction on maintaining a working environment that is inclusive of everyone, regardless of culture, national origin, race, color, gender, gender identification, sexual orientation, family status, age, veteran status, disability, religion, or other basis protected by applicable laws. Should you require accommodations during the selection process, please contact accomodationrequests@opentext.com ).",1,1,1,1,0,0,0,0,0,0,0,0,0,0,1,0,0,0,0,0,0,0,0,0,0,0,0,0,0
59,0,Data Analyst,https://ca.indeed.com/rc/clk?jk=4e1c91cd37ad5f00&fccid=0f25788b92067625&vjs=3,"Who We AreWorkTango was founded as a passion-driven business to improve (work) lives. Not just talking the talk, WorkTango is a company full of committed and smart people also delivering on this passion. Clients in over 90 countries use WorkTango to provide actionable insights throughout their organizations to make work better. WorkTango’s internal metrics; 80 eNPS (employee satisfaction) score for the last 18 months, 4% turnover and 100% positive company outlook, provide the quantifiable proof that they’re experts in creating great workplaces. Based on continued growth over the last 6 years, WorkTango is looking for a Junior Analyst to support our clients and help them turn data into meaningful insights.What You Will DoWork directly with clients on analysis and reporting projectsInterpret Insights from Employee Voice Initiatives: Interpreting vast amounts of survey data and share insights on trends, relative data, predictive analytics, and offer targeted recommendations.Manage our ETL process for client data transfers to enrich our proprietary data setProduce research reports on trends in employees experience across various verticalsProvide expert knowledge and support to our growing client base: Working collaboratively with the rest of the Client Success team to provide red-carpet support to our clientsOffer customer support to our clients helping troubleshoot issues and liaising solutions with our Technical teamMake impactful and creative decisions: Find creative solutions to customer requests and providing customers an experience that they will LOVE!Who You AreCustomer obsessed: In this role, you will be working closely with our Operations team to support our customers. Aside from preparing reports, you'll be offering customer support to clients using our platform.You have aptitude with numbers: Numbers don't scare you, they excite you! The ability to understand and interpret data is a must-have for this roleYou are a self-starter: You take great pride in being the first person to help a customer, takes initiative on projects, and using your skills and experience to improve the customer experienceYou are growth-oriented: You are continually honing your craft and keeping up with the best tools for the job. We take great pride in making sure you are qualified for your next role.You are organized: You take great care in keeping not only your data, but customer data, and your team’s data well maintained and easily accessible. You keep to sometimes short timelines and launch dates.You are a person of integrity: Honesty, trust, and ethical decision-making are at the core of who we are. These are important to you and you model these values in your interactions with colleagues, customers, and stakeholders.You are adaptable and comfortable with the unknown: We’re small and move fast, so you will have a whole whack of responsibility and impact. You are comfortable with taking on projects that push your limits beyond what you thought possibleRequirements and Needed SkillsBachelor's Degree or equivalent from a university with proficiency in data analytics1+ years experience working with advanced Excel and data analysis, specifically with large datasets requiring data managementLoves people and building solid business relationships – passionate about helping our customers meet their goalsExperience in project management and client service in a B2B setting is considered an assetSelf-starter able to operate with ambiguous or imperfect information and can collaborate effectively with a teamWhy work with usIn addition to a competitive salary, health and dental benefits, and a generous maternity/paternity structure for an organization our size, WorkTango provides unlimited vacation, a flexible work schedule in a hybrid working environment based on each employee’s needs, and equity-based on performance. While many companies say they provide unlimited vacation we actively track and ensure people are getting time off and we encourage you to take more than you need. If you want to contribute to improving the (work) lives of others, help grow a tech company with raving-fans as clients, see below to apply.To ApplyPlease send your resume.We are a respectful workplace committed to building a skilled and diverse workforce. We believe in fostering an inclusive work environment where all individuals have an opportunity to succeed. We welcome and encourage applications from everyone. Requests for accommodation can be made at any stage of the recruitment process. Our commitment to equity outlines the actions we take to ensure we live this virtue and can be found here.We look forward to hearing from you!",1,0,1,0,0,0,0,0,0,0,0,0,0,0,0,0,0,0,0,0,0,0,0,0,0,0,0,0,0
60,0,Data Analyst - FIFA,https://ca.indeed.com/rc/clk?jk=5ee040a9ed8d2014&fccid=617d7f961cfcf54a&vjs=3,"At EA, we inspire the world to play by developing, publishing, and distributing the world's best games. Our EA Vancouver studio is looking for a Data Analyst to support our FIFA franchise. Reporting to the lead analyst on FIFA's live services, you'll work with the live product & content teams along with colleagues in analytics around the world. We're looking for someone with a passion for diving into data to uncover insights. You'll not only be a data explorer and modeler, but also a data storyteller who will help guide the company to create extraordinary gaming experiences for our players.Examples of projects you may work on include: assessing campaign content impact, reporting on content performance, projecting engagement patterns, and tuning mode features and player rewards.What you'll do on our team:Receive questions from our partners, determine the best ways that our data can help answer them, and provide insights through dashboards, reports, or presentations.Develop insights to help our partners make informed decisions about in-game campaign planning.Work with game producers to understand their needs and translate analysis into realistic recommendations.Explore player behaviour patterns in our data to identify opportunities to improve the player experience.Model trends in our data to predict the ways in which new content and campaigns will affect our performance.Present analyses and findings to our partners in a clear and understandable way.What we're looking for:A degree in Business, Statistics, Mathematics, Economics, Data Science, Analytics, or a related field.2+ years of experience in an analytics role using data to help guide decisions in a consumer products-oriented industry (e.g. gaming, entertainment, e-commerce).Excellent SQL querying skills.Proficiency analyzing large datasets in a spreadsheet program or in a programmatic analysis tool (e.g. Python, R).Experience with data visualization applications (e.g. Tableau, R Shiny).Experience in statistical modeling (e.g. regression, clustering, predictive modeling).",1,1,1,1,0,0,0,0,0,0,0,0,0,0,0,0,0,0,0,0,0,0,0,0,0,0,1,0,0
61,0,Health Data Analyst,https://ca.indeed.com/rc/clk?jk=cce7afb82009b62b&fccid=545a4a9f500fa727&vjs=3,"The Approaches to Community Wellbeing is a regional resource to 31 First Nations Communities. The Approaches to Community Wellbeing provides expertise, support, services, and programming in public health to the region. The program also supports communities in the development, implementation, and monitoring of their own Approaches to Community Wellbeing. The Roots for Community Wellbeing section of the model includes data collection and analysis, planning and evaluation, research, ethics, policy, capacity building, and communications.The Health Data Analyst is responsible for the ongoing collection, extraction, analysis, interpretation, and dissemination of data and health information that help in public health planning, implementation, and decision making. The Health Data Analyst gathers and analyzes information from various sources to support service delivery and public health care systems for the Sioux Lookout area First Nation communities. Moreover, the information will be used to track the trends in health indicators over time, create health status reports, policy briefs, and health promotion materials for each community and the region. The Health Data Analyst will also gather, analyze, and interpret reportable diseases and other health conditions to identify priority areas for programming.The Health Data Analyst is directly accountable to the Roots for Community Wellbeing Manager.Salary range starting from $61,228 to a maximum of $78,804/yearly based upon 1,820 hours.Who can apply: Persons of First Nations ancestry will be given preference (s.16 (1)CHRA)MINIMUM QUALIFICATIONS:Post-secondary degree in public health, biostatistics, epidemiology, health promotion or related discipline and/or combined relevant experienceOwnership, Control, Access, and Possession (OCAP®) certificationMust have working knowledge of determinants and regulatory process impacting First Nations health and First Nations governanceKnowledge of the complex health service delivery landscape in northern Ontario and the inter-jurisdictional issues as they relate to the First Nations healthGood data scripting and programing skills including proficiency in using query languages, codes statistical testing, regression, etc.Experience with common data science and data visualization toolsAbility to extract, analyze and interpret data as well as prepare and deliver high quality written reports and presentations for diverse audiences with the ability to express ideas clearly, concisely, and respectfullyUnderstand and facilitate data gathering, analysis, and interpretation for health program design and the interrelationship of data with health policy and programExperience with excel, SPSS, and other data systemsExperience with First Nations community engagement, community-based research and First Nations decision making processesExcellent interpersonal, communication, advocacy and organizational skillsAs per policy, applicants should note that COVID-19 immunization is a condition of employment within SLFNHA.RESPONSIBILITES AND DUTIES:Create and replicate statistical codes, statistical programs and develop and maintain complex data bases and coding algorithmsCollect, create, analyze, and disseminate information and evidence to support health planning and decision makingCollect and analyze data—through extracting secondary data, observations, interviews, and surveys to find the causes/associations of diseases or other health problems in First Nations CommunitiesSupport the Preventing Infectious Diseases team in data tracking (i.e. line lists) and communicable diseases surveillance.Identify effective methods of knowledge transfer based on specific targeted audiencesFacilitate the establishment and strengthening of effective networks and relationships with all levels of leadership/government and other experts as requiredParticipate in the launch and management of Epi briefs, health status reports, and advocacy strategies related to the SLFNHA priorities for its communities based on evidenceProvide data to support funding opportunities through proposals and partnerships with other agenciesProvide support for the regional strategic health planning function of SLFNHA and facilitate the continued implementation of the Anishinabe Health Plan.Work alongside teams within ACW or the management team to establish program needsResearch, review, monitor and analyze provincial and federal government data sources and policies which affect the health and health services for First Nations in the Sioux Lookout areaCommunicate data findings to health practitioners, policymakers, and Tribal CouncilsAll other duties as assigned",1,0,1,0,0,0,0,0,0,0,0,0,0,0,0,0,0,0,0,0,0,0,0,0,0,0,0,0,0
62,0,Data Analyst,https://ca.indeed.com/rc/clk?jk=a2aa597b39bd1f3b&fccid=90a879ec57bb8dcb&vjs=3,"About NōwnNōwn POS is the all-in-one customer recognition retail solution. We put the focus on the person behind the purchase. We’re out to prove that traditional loyalty programs don’t work and scalable, authentic connections between a business and their customers is the only path to success. We’re taking over the retail & quick serve markets and we want your help to do it.About the RoleIf you love digging into the root causes of problems, finding patterns and are looking for a dynamic, forward-looking work environment then this is the role for you. You will be responsible for supporting the work of Engineers in developing and delivering data driven products, tools, and workflows.ResponsibilitiesExpertly leverage data and visualization tools including SQL, Excel, and Tableau, among others, to present actionable insightsLead independent analytical research projectsInterpret and define the data needs of business teamsBuild visualizations of data using dashboarding, visualization, and other reporting toolsProvide analytical and data-driven decision-making support for key projectsBalance quantitative data analysis with qualitative user insights to uncover how our users interact with our productsEmpower our largest enterprise customers to leverage data with as-needed database requestsOur dream candidate has...Sound understanding of relational databases (SQL Server, Amazon Redshif, NoSQL etc.)Experience with data visualization and presentation, including tool sets for supporting thisGreat communication skills with the equal ability to work with developers as well as translating to non-technical business stakeholders with easeHas the ability to build and manage databasesEnjoys solving problems and seeks to understand the story behind the numbersExperience with E-Commerce, Retail and Business Analytics would be an assetCan turn an abstract question into a series of SQL queries, and can turn data into a storyNice to have: experience working in a customer-facing environmentCulture FitWe have a small team and we LOVE working with each other. We want someone who wants to fit and grow with our culture.This includes working hard, not being afraid of trying anything, helping each other out when needed, and being POSITIVE. Positive energy is big here!Salary: Commensurate with experienceHere's what we provideAn office conveniently located downtownSnacks and COFFEEThe opportunity to work with a team of amazing people in an entrepreneurial, forward thinking environmentA dog friendly officeIncredible social eventsTo apply, please email careers@lucova.com and include your resume.",1,0,1,1,1,0,0,0,0,0,0,0,0,0,0,0,0,0,0,0,0,0,0,0,0,0,1,0,0
63,0,Data Analyst- Central Production,https://ca.indeed.com/rc/clk?jk=22821c9d0dc0b4c0&fccid=811abf1449d39b5f&vjs=3,"Who we areWe are “Monsters / Aliens / Robots / Zombies” (MARZ). We are a Technology & VFX studio based out of Toronto, ON, Canada, offering feature-film quality VFX on TV timelines. We launched in 2018, and have had the privilege of working on a wide range of projects such as WandaVision (Disney+), The Boys (Amazon Prime), Watchmen (HBO), The Walking Dead (AMC), What We Do In The Shadows (FX), The Umbrella Academy (Netflix), Invasion (Apple TV), and many more!Who we needDo you live and breathe Excel? Do you find yourself reading up on data modeling techniques? Do you dream about their unlocked potential in VFX? So do we! You’ll be working with senior staff who are a mix of VFX veterans and new blood—so you’ll fit right in, no matter how much you know about the weird wild world of visual effects.We are looking to add a talented Analyst to our dynamic, growing, and passionate Central Production team, and we are open for this person to work remotely. This is a full-time role that reports directly to the Central Production Manager, and responsibilities will include:Working with the Central Production Manager on resourcing, scheduling, and other data-heavy processesWorking with our CTO, COO, Head of Central Production, Digital Supervisor, and individual departments to define and execute on R&D initiativesCreating data modeling techniques to calculate the ROI of R&D investmentsAnalyzing department OKRs to improve the metrics used to evaluate our output and updating OKRs on an ongoing basisTracking and optimizing initiatives to improve the utilization and efficiency of the departmentsUpgrading the cost reporting system to better track project profit and loss actualsWorking on Shotgrid, an Excel-like project management software (prior experience with Shotgrid is not required)What you bringWe are looking for a junior/intermediate level Technical Business Analyst with the following experience and skills:A Bachelor’s Degree in a Business or Technology discipline, or similar3+ years experience as a Technical Business Analyst, Data Analyst, Production Analyst, or a similar roleExcellent Excel knowledgeThe ability to work on multiple projects, with a variety of people, in a fast-paced environmentAn interest in the visual effects, film, TV or entertainment sector (experience an asset but not required)What happens nextAfter we receive your application, it will be reviewed by the Talent Acquisition team and the Hiring Manager. We will then invite successful candidates to a screening call with a member of our Talent Acquisition team (~20-30 mins). This will be followed by an interview with members of our Leadership team (~60 mins). All interviews are conducted via Google Meet. This process is subject to change at any time, but will follow as close to the above as possible at all times.Why MARZMARZ is a Technology & VFX company on a mission to help Hollywood studios push the boundaries, quality, and volume of TV content by delivering feature-film quality VFX on TV timelines. MARZ does this by harnessing proprietary AI software, GPU clusters, game engine technology, and world-class industry talent. Leveraging these pillars allows MARZ to consistently execute high volumes of shots with both speed and quality for our premium TV projects.At MARZ, we are an equal opportunity employer that values diversity and does not discriminate on any protected characteristic as defined by applicable law. We are committed to providing reasonable employment accommodations as per the Ontario Human Rights Code and the Accessibility for Ontarians with Disabilities Act.We will also look to provide reasonable accommodations as required for applicants to participate in the application and interview processes. Please let us know if you require any accommodation(s). We can be reached via email at jobs@marzvfx.com, via the Contact Us page on our company website, or via phone at +1 (416) 840-5556. Please note that we cannot accept general applications via any of these contact methods; they are specifically for providing support and/or accommodations to those who require such assistance.",1,0,1,0,0,0,0,0,0,0,0,0,0,0,0,0,0,0,0,0,0,0,0,0,0,0,0,0,0
