,Job Title Index,Job Title,Link,Job Description,Excel,Python,R,SQL,NoSQL,pyspark,java,Javascript,html,Julia,Swift,Bash,Matlab,GCP,AWS,Azure,Big data,Hadoop,MySQL,PostgreSQL,Oracle,MongoDB,Snowflake,IBM,Redshift,Power BI,Tableau,SAP,Qlik
25,0,Data Analyst,https://ca.indeed.com/rc/clk?jk=206920e4c96d70f0&fccid=c40235e380385157&vjs=3,"APOLLO is a digital insurance company. Our platform, the APOLLO Exchange, launched in 2019 and now offers the largest selection of online insurance for small businesses in Canada. We recently launched renters insurance and continue to rapidly expand our product offering. The Exchange reduces what can commonly be a painful weeks-long process of back and forth into simple and immediate digital fulfillment. Five minutes is all it takes to get covered, 24/7, from anywhere and any device.APOLLO is a team of empowered and driven individuals who live our core values of Candor, Integrity, Adventure, Desire and Courage every day. Being a part of APOLLO offers a chance for the right applicant to make a name for themselves, and help build APOLLO as a leader on the forefront of the digital innovation of a global, $5 trillion dollar industry.As a Data Analyst, you’ll be working closely with the Senior Director of Data, the Engineering team, Project/Product Managers and also with business stakeholders. You’re the kind of person who likes challenging, technical work, and your favorite parts of the day are getting down to designing solutions and coding them up. But you’re also great at interacting with stakeholders, including those in teams that are more business-focused and less technical than yours. This role will cover predominantly data engineering, but there will be a request for a report or an ad-hoc query here and there. Working in a small but growing analytics team in a startup, you’ll sometimes need to wear more than one hat, but you enjoy doing that every now and then.You’ll also be working with impressively clean data, great stakeholders, leading edge tools such as Snowflake, Metabase, and Prefect. This is a great opportunity to get on board with a fast-growing company where you can make big contributions to its success.Responsibilities:Build new reports and dashboards, and perform occasional ad-hoc analysis for partner teams like Business Development, FP&A, and othersWork with stakeholders to gather requirements for new dashboards and reportsPerform ad-hoc analysis when neededLiaise with partner teams to help with interpretation of reporting and analyses and strengthen APOLLO’s data literacy across the orgCreate and maintain analytical queries and datasets (views, tables, ad-hoc queries) and BI tool (semantic layer, queries)Connect regularly with the Product Engineers to stay on top of Apollo’s applications as they change, and ensure data from these apps is always interpreted correctly in our analyticsHelp to maintain the APOLLO data dictionary to ensure you, the technology team, and all stakeholders have a clear understanding of what all the various metrics in the business mean and how they’re madeOther duties as requiredSkills & Qualifications:3+ years experience in a Data Analyst roleExperience being accountable for mission-critical reportingBachelor’s degree or greater in a field involving computer science and/or quantitative analysis such as Economics, Mathematics, Sciences, Engineering, or otherStrong business acumenGenuine curiosity about how every business unit works and how to help them succeedWorking experience in Python and SQLFunctional knowledge of predictive modeling with PythonExperience working with one more BI tools such as Metabase, Looker, Tableau, PowerBI, or similarExperience building customized and advanced visualization with libraries such as plotly, seaborn, matplotlib, or bokeh is a bonusExcellent understanding of data governance, and the sheer willpower to always document new or changed data definitions, because you know it’s the smart thing to do, even though you’d rather be codingFamiliarity with a wide variety of data structures and formatsThis position is 100% remote anywhere in Canada!Team collaboration:APOLLO believes in a team approach where all members have equal opportunity to voice ideas to advance the agenda of the Company and its clients. Working well in a team, taking initiative, and possessing a desire for greatness is important. Must have excellent communication skills and an ability to collaborate effectively to move the best ideas forward.Benefits & Perks:Professional development & licensing supportMonthly Social Club EventsUnlimited vacation (yes, unlimited paid time off!)Medical, Dental and Vision benefits - premiums covered by APOLLO!Employee Assistance Program (EAP)Monthly Wellness program - $100 monthly for well-being activitiesDigital first & work from home flexibilityCentral Gastown office in Vancouver just blocks from the seabus terminal open to all employees!",1,1,1,1,0,0,0,0,0,0,0,0,0,0,0,0,0,0,0,0,0,0,1,0,0,0,1,0,0
26,0,Data Analyst,https://ca.indeed.com/rc/clk?jk=ad2e9a39cc17526f&fccid=a1707b0d13b0776e&vjs=3,"The University of New Brunswick Fredericton welcomes applications for the position of Data Analyst with the New Brunswick Institute for Research, Data & Training (NB-IRDT). This is a full-time (36.25 hours per week), term position ending November 21, 2022, with the APT employee group. The position is funded by external monies with a salary range of $54,158 - $70,403 per annum.NB-IRDT is a research institute at UNB and the sole provincial administrative data repository in New Brunswick. We house privacy-protected population-level data, which we use to conduct research that supports informed policy- and decision-making to promote the health and social prosperity of New Brunswickers.Position summary:Assist GNB departments and external agencies in preparing data sets to move to NB-IRDT repository.Clean, manage, and analyze large provincial administrative databases. Identify and advise on data limitations, and collaborate with GNB and NB-IRDT staff on solutions to overcoming those limitations.Complete data stewardship functions, including data validation to ensure its accuracy.Create and update reference guides for data sets.Assist researchers in the development of study protocols, data measures, data creation plans, and analytic plans. Assist researchers in the preparation of forms required for access to NB-IRDT data.Provide research support to users in the NB-IRDT lab and supervision to research assistants.Output, interpret, and communicate statistical results with project team and external stakeholders.Contribute to writing research reports and scientific manuscripts for academic publication.Provide comprehensive reviews of NB-IRDT feasibility forms and data access applications. Provide counsel on data access quotes.Prepare analytic data sets, and conduct and interpret data analyses using population-based administrative clinical registry and survey data.Participate in the planning, development, and implementation of new research initiatives.Contribute to writing research reports and scientific manuscripts for academic publication.Assist in the development and production of the NB-IRDT strategic plan.Requirements/Skills:Master's degree in Epidemiology, Economics, Science, Biostatistics, or a related field.3-5 years' experience in manipulating large complex data sets and applying statistical and epidemiological methods and principles to health services research.Experience with data such as hospital discharge, outpatient, and related databases, and with survey data.Excellent knowledge of statistical software (SAS, STATA, R, MATLAB) and Microsoft Office.Substantial statistical programming experience, including managing, merging, and analyzing data sets.Strong knowledge of descriptive statistics, statistical inference, survival analysis & advanced statistical modeling. Ability to output, organize and interpret statistical results in reports for diverse audiences.Excellent written and interpersonal communication skills. Effective problem-solving and decision-making skills.Exceptional organizational/time management skills. Ability to work independently and in a team environment.French is considered an asset.Closing date for applications is November 16, 2021 4:30PM. We thank all applicants for their interest but only those selected for an interview will be contacted.The University of New Brunswick is committed to employment equity and fostering diversity within our community and developing an inclusive workplace that reflects the richness of the broader community that we serve. The University welcomes and encourages applications from all qualified individuals who will help us achieve our goals, including women, visible minorities, Aboriginal persons, persons with disabilities, persons of any sexual orientation, gender identity or gender expression. Preference will be given to Canadian citizens and permanent residents of Canada.",1,0,1,0,0,0,0,0,0,0,0,0,1,0,0,0,0,0,0,0,0,0,0,0,0,0,0,0,0
27,0,Data Analyst,https://ca.indeed.com/rc/clk?jk=69c6159f79e3edd3&fccid=966bd00de3e8ab9d&vjs=3,"Marketing StatementA career at TransLink and our family of companies means working with people with a wide range of skills and perspectives, all teaming up towards a common goal: preserving and enhancing the region's world-envied quality of life. Together, we connect the region and enhance its livability by providing a sustainable transit and transportation network, embraced by our communities and people.At TransLink we are dedicated to building a workforce that reflects the diversity of the communities in which we live. We’re committed to fostering an inclusive, equitable and accessible workplace, recognizing the unique value and skills every individual brings.Looking for a great place to work where your contributions are valued and you can make a difference in a vibrant city? At TransLink, one of BC’s Top Employers, you'll help make Metro Vancouver a better place to live, built on transportation excellence. Put your future in motion!ResponsibilitiesPerforms data analysis of Enterprise data and provides expertise and advice to business and BTS stakeholders on the application of Data Management practices and principles. Supports the enterprise Information Governance program. Performs detailed analyses of business areas to identify, understand, model and define data, business data flows and processes in conjunction with business and BTS stakeholders. Identifies data anomalies, patterns, overlaps and duplications and recommends improvements according to data management best practices and TransLink standards. Develops and implements data quality control and monitoring solutions to support data quality for the enterprise. Works with application support teams, the Data Warehouse team and system development project teams to offer Data Management expertise and services. Creates and maintains the conceptual, logical and physical data models that form the Enterprise data architecture and updates the corporate metadata repository, ensuring the integrity and consistent definition and use of Enterprise data. Keeps up to date with new developments in data management practices and technologies to support and improve data management services. Installs, maintains and administers tools and applications owned by the Data Management Team.QualificationsEDUCATION:Diploma in computer systems technology, with emphasis in database design, data modeling, systems analysis, system development methodologies and the use of C.A.S.E. tools.EXPERIENCE:Requires three (3) years previous experience in an environment where logical/physical data modeling, data analysis techniques, data management and business analysis skills have been demonstrated. Requires a further period of up to one (1) year in the position to become familiar with Translink’s business operations and environment and the business requirements for data and information.Other InformationRecruitment Process: An applicant will be required to demonstrate their suitability for this position by meeting the minimum level of qualifications and experience in order to be invited into the selection process. A standard interview format will be used including general, scenario and behavioural descriptive interview questions.Beneficial experience: The BI team is currently migrating data warehouse components to the cloud. Experience in Azure data components would be beneficial.COVID-19 Safety Vaccination PolicyTo support public health, and protect the health and safety of our employees, customers, and their families, TransLink employees will be required to be fully vaccinated against COVID-19 and will need to provide proof of full vaccination status in compliance with the employer’s COVID-19 Safety Vaccination Policy.Accommodations may be applicable under the BC Human Rights Code. Should an applicant be unable to provide proof of full vaccination and should an accommodation be requested, additional information will be required to determine whether the individual is entitled to be accommodated.Work Schedule37.5 hours per week.Rate of PaySalary starting from $7,044 per monthFTR External All:The Total Compensation Package includes Extended Health, Dental, Transit Pass and enrollment in the Public Service Pension Plan. Focus on your development through tuition reimbursement, training, and mentorship programs. Enjoy a variety of health and wellness programs, including access to gym facilities. Speak to us to know more about what we offer.How to ApplyPlease click the 'Apply' button at the top right corner of the page or go to http://www.translink.ca/careers to apply for this position and view instructions on the process.INSTRUCTIONS: Please save your (1) cover letter, and your (2) resume as one pdf document prior to uploading your application on-line.Posting Date: 05 November 2021Closing Date: Open until filledPlease note that only those short listed will be contacted.Having trouble applying? Please view the System Requirements & FAQ's by going to http://www.translink.ca/careers.Equal Employment OpportunityWe are an equal opportunity employer committed to creating and supporting a diverse and inclusive workforce that is free of all forms of discrimination. We are committed to providing reasonable accommodations and will work with you to meet your needs. If you are a person with a disability and require assistance during the application process, please reach out! We celebrate our inclusive work environment and welcome members of all backgrounds, skills and perspectives.Accommodations are available on request for candidates taking part in all aspects of the selection process. For a confidential inquiry, simply email us at jobs@translink.ca.",1,0,1,0,0,0,0,0,0,0,0,0,0,0,0,1,0,0,0,0,0,0,0,0,0,0,0,0,0
28,0,Data Analyst,https://ca.indeed.com/company/Bitbuy-Technologies-Inc./jobs/Data-Analyst-fcc63c78c3788c81?fccid=4fde151bbecd30ba&vjs=3,"About UsAt Bitbuy, our mission is clear: to provide convenient, dependable and secure access to Bitcoin and other digital currencies. We believe that cryptocurrency is paving the way for retail, and corporate investors alike.Being Canada’s most trusted platform is not easy. We pride ourselves in providing top-notch security, convenient funding options, and unmatched customer service for our users.Bitbuy is a Federally Incorporated organization and is registered with FINTRAC as a Money-Service Business. Our business won a Notable Startup award in 2018 and ranked 54th on 2020 Startup list by Canadian Business. With offices in Toronto and Halifax, we are now proudly a team of over 50 talented individuals and counting. Our team has grown over the past year as our plans to grow continue!Position overviewReporting directly to Bitbuy’s COO, you will be required to help our Marketing, Product, Sales, Operations and Leadership teams make more informed decisions through clear presentation of our business metrics.Responsibilities- Organize and analyze data related to all Bitbuy paid and unpaid marketing channels including affiliate, digital, social, audio, broadcast and more- Work alongside Bitbuy’s engineering team to interpret and analyze internal data sets of product usage, particularly how they affect the business- Regularly collect and present data findings to team leadership and assist in making data driven marketing and business decisions- Conduct deep analysis to gain deeper cause-and-effect insight into business performance and initiatives- Ensure KPIs are being provided in a timely manner and consistent manner through ongoing reports- Assist in Business Intelligence integration- Regularly collect and present data findings to leadershipWho You Are- You have 2-4 years of experience in an analytics or business intelligence role- You have experience working with data in a B2C marketing environment- You're experienced in using MySQL, Python, Pivot Tables, Excel Tableau, Email Marketing systems, and, working with large data sets- You have advanced financial, statistical and data analysis skills- You are a strong communicator of analytical findings- You have worked in a face paced, agile- You have a strong customer focus, with experience in consumer and marketing research- You have worked with digital marketing platforms and offline marketing measurement tools- You are familiar with crypto and financial marketsBitbuy is committed to providing accommodations at all stages of the recruitment process in accordance with applicable human rights and accommodation legislation. If contacted for an employment opportunity, please advise us if you require accommodation.Job Type: Full-timeSalary: $75,000.00-$90,000.00 per year",1,1,1,1,0,0,0,0,0,0,0,0,0,0,0,0,0,0,1,0,0,0,0,0,0,0,1,0,0
29,0,Data Quality Analyst,https://ca.indeed.com/rc/clk?jk=a41b59ef72a4e93f&fccid=434a4974c491879d&vjs=3,"We are a technology company that equips organizations to be agile and innovative, and for their people to be productive, creative and happier at work. That means moving them to the cloud, helping them build the workplace of tomorrow, and enabling them to make smarter decisions about their technology portfolio. By doing these things, we create success faster and in circumstances otherwise not possible.We stand proudly for our people and support their success through career development and advancement. We are recognized and respected for our culture of inclusion and belonging, continuously striving to do what’s good for our people and communities.The impact you will have:As a Data Quality Analyst within the Master Data team, you will work directly with Softchoice leaders and business stakeholders to promote consistency, quality, integrity, and standardization of shared data across Softchoice. Your focus will be to implement data quality monitoring and develop business metadata management capabilities. You will engage the Data Stewards to define and build business data quality rules, document business data definitions and recommend master data management process improvements.What you’ll do:Engage Data Stewards and business stakeholders to capture data quality requirements.Implement automated data quality assessments against business rules using Azure Data Factory and Power BI.Investigate root causes of data integrity issues and recommend remediation approaches to Data Stewards.Support the implementation of Azure Purview for data governance, metadata management, and business glossary.Coordinate with data stakeholders to align on approved definitions for key business terms.Implement a change management process for approved business definitions.Develop data quality dashboards in PowerBI to report data quality metrics and trends.What you’ll bring to the table:A post-secondary Degree or Diploma.3+ years of related experience in data quality management, data analysis and data governance.Strong development experience in Azure Data Factory, PowerBI and ETL procedures.Hands-on experience building data quality checks and writing complex SQL queries.Strong understanding of data quality monitoring procedures.Solid knowledge of data governance, metadata management principles and data definitions.Excellent verbal, written, communication, presentation, organizational, and interpersonal skills.Strong problem-solving ability and analytical thinking.Why people love working here:Softchoice has been recognized as a Best Workplace in Canada by the Great Place to Work Institute for 16 consecutive years.Softchoice has been certified as a Great Place to Work in the United States for several years.We offer meaningful work and opportunities for career growth.Our team members have 2 paid volunteer days per year to give back to a cause of their choice.We offer an opportunity to build a career in the technology industry.We have raised over $3 million through Softchoice Cares, our grassroots fundraising organization.Inclusion & Equal opportunity employment:We are an equal opportunity employer committed to diversity, inclusion & belonging. People seeking employment at Softchoice are considered without regard to any protected category including but not limited to, race, color, religion, national origin, age, sex, marital status, ancestry, disability, veteran status, gender identity, or sexual orientation.Require an accommodation? We are ready to help:We are proud to provide interview & employment accommodation during the recruitment and hiring process. If you require any accommodation to apply or interview for a position, please reach out directly to asktalentacquisition@softchoice.com. We are committed to work with you to best meet your needs.Our commitment to your experience:We are committed to the safety of all candidates and team members. With that in mind, we have implemented virtual interviewing for everyone. We understand that you may need to interview with distractions around you (such as children or furry friends) and we will most likely be doing the same.Before you start with us, we will conduct a criminal record check, verify your education and check your references.When you join Softchoice, we will onboard you remotely. Don't worry. It's quick, simple and you'll be connected with your new team in no time.Job Requisition ID: 3339EoE/M/F/Vet/Disability#L1-KM1",1,0,1,1,0,0,0,0,0,0,0,0,0,0,0,1,0,0,0,0,0,0,0,0,0,1,0,0,0
